{
  "version": 1,
  "case_id": "n31_media_change",
  "artifact_type": "TRAINING_VIDEO_EVIDENCE_PACK",
  "generated_at": "2026-07-17T03:07:06.083107+00:00",
  "training_video_sha256": "61ec74826befc89889a6025a9acdb217adbd32af589a9c1f4bb4be1958ff695f",
  "contains_raw_media": false,
  "contains_credentials": false,
  "scenes": [
    {
      "scene_id": "V00",
      "kind": "INTRO",
      "step_ids": [],
      "source_id": "N31_VIDEO_OPERATION_FULL",
      "start_ms": 10000,
      "end_ms": 16000,
      "conditional": false,
      "evidence_ids": []
    },
    {
      "scene_id": "V01",
      "kind": "STEP",
      "step_ids": [
        "S01"
      ],
      "source_id": "N31_VIDEO_OPERATION_FULL",
      "start_ms": 0,
      "end_ms": 5000,
      "conditional": false,
      "evidence_ids": [
        "E001",
        "E096",
        "E144"
      ]
    },
    {
      "scene_id": "V02",
      "kind": "STEP",
      "step_ids": [
        "S02"
      ],
      "source_id": "N31_VIDEO_MEDIA_TYPE",
      "start_ms": 0,
      "end_ms": 5000,
      "conditional": false,
      "evidence_ids": [
        "E066",
        "E096",
        "E149"
      ]
    },
    {
      "scene_id": "V03",
      "kind": "STEP",
      "step_ids": [
        "S03"
      ],
      "source_id": "N31_VIDEO_OPERATION_FULL",
      "start_ms": 40000,
      "end_ms": 45000,
      "conditional": false,
      "evidence_ids": [
        "E009",
        "E145"
      ]
    },
    {
      "scene_id": "V04",
      "kind": "STEP",
      "step_ids": [
        "S04"
      ],
      "source_id": "N31_VIDEO_OPERATION_FULL",
      "start_ms": 65000,
      "end_ms": 70000,
      "conditional": false,
      "evidence_ids": [
        "E014",
        "E142"
      ]
    },
    {
      "scene_id": "V05",
      "kind": "STEP",
      "step_ids": [
        "S05"
      ],
      "source_id": "N31_VIDEO_OPERATION_FULL",
      "start_ms": 85000,
      "end_ms": 90000,
      "conditional": true,
      "evidence_ids": [
        "E018",
        "E141"
      ]
    },
    {
      "scene_id": "V06",
      "kind": "STEP",
      "step_ids": [
        "S06"
      ],
      "source_id": "N31_VIDEO_GUIDES",
      "start_ms": 0,
      "end_ms": 5000,
      "conditional": true,
      "evidence_ids": [
        "E069",
        "E146"
      ]
    },
    {
      "scene_id": "V07",
      "kind": "STEP",
      "step_ids": [
        "S07"
      ],
      "source_id": "N31_VIDEO_GUIDES",
      "start_ms": 25000,
      "end_ms": 30000,
      "conditional": false,
      "evidence_ids": [
        "E074",
        "E098"
      ]
    },
    {
      "scene_id": "V08",
      "kind": "STEP",
      "step_ids": [
        "S08"
      ],
      "source_id": "N31_VIDEO_MEDIA_FEED",
      "start_ms": 0,
      "end_ms": 5000,
      "conditional": false,
      "evidence_ids": [
        "E079",
        "E098"
      ]
    },
    {
      "scene_id": "V09",
      "kind": "STEP",
      "step_ids": [
        "S09"
      ],
      "source_id": "N31_VIDEO_LEARNING",
      "start_ms": 0,
      "end_ms": 7000,
      "conditional": false,
      "evidence_ids": [
        "E077",
        "E104",
        "E148"
      ]
    },
    {
      "scene_id": "V10",
      "kind": "STEP",
      "step_ids": [
        "S10"
      ],
      "source_id": "N31_VIDEO_OPERATION_FULL",
      "start_ms": 215000,
      "end_ms": 220000,
      "conditional": false,
      "evidence_ids": [
        "E044",
        "E104",
        "E150"
      ]
    },
    {
      "scene_id": "V11",
      "kind": "STEP",
      "step_ids": [
        "S11"
      ],
      "source_id": "N31_VIDEO_OPERATION_FULL",
      "start_ms": 235000,
      "end_ms": 240000,
      "conditional": true,
      "evidence_ids": [
        "E048",
        "E104"
      ]
    },
    {
      "scene_id": "V12",
      "kind": "STEP",
      "step_ids": [
        "S12"
      ],
      "source_id": "N31_VIDEO_PRINT_RESULT",
      "start_ms": 0,
      "end_ms": 5000,
      "conditional": false,
      "evidence_ids": [
        "E082",
        "E150"
      ]
    },
    {
      "scene_id": "V13",
      "kind": "STEP",
      "step_ids": [
        "S13"
      ],
      "source_id": "N31_VIDEO_PRINT_RESULT",
      "start_ms": 5000,
      "end_ms": 10000,
      "conditional": false,
      "evidence_ids": [
        "E083",
        "E154"
      ]
    },
    {
      "scene_id": "V14",
      "kind": "OUTRO",
      "step_ids": [],
      "source_id": "N31_VIDEO_PRINT_RESULT",
      "start_ms": 10000,
      "end_ms": 17000,
      "conditional": false,
      "evidence_ids": []
    }
  ],
  "evidence": [
    {
      "claim": "CONTINUOUS_OPERATION 关键帧候选；等待授权后的视觉理解或人工确认动作、部件和设备状态。",
      "classification": "MODEL_INFERENCE",
      "confidence": 0.5,
      "evidence_id": "E001",
      "locator": {
        "end_ms": 5000,
        "keyframe": "derived/video/N31_VIDEO_OPERATION_FULL/frames/frame_000001.jpg",
        "start_ms": 0
      },
      "relevance": 0.65,
      "review_status": "UNREVIEWED",
      "source_ref": "N31_VIDEO_OPERATION_FULL",
      "source_type": "video"
    },
    {
      "claim": "CONTINUOUS_OPERATION 关键帧候选；等待授权后的视觉理解或人工确认动作、部件和设备状态。",
      "classification": "MODEL_INFERENCE",
      "confidence": 0.5,
      "evidence_id": "E009",
      "locator": {
        "end_ms": 45000,
        "keyframe": "derived/video/N31_VIDEO_OPERATION_FULL/frames/frame_000009.jpg",
        "start_ms": 40000
      },
      "relevance": 0.65,
      "review_status": "UNREVIEWED",
      "source_ref": "N31_VIDEO_OPERATION_FULL",
      "source_type": "video"
    },
    {
      "claim": "CONTINUOUS_OPERATION 关键帧候选；等待授权后的视觉理解或人工确认动作、部件和设备状态。",
      "classification": "MODEL_INFERENCE",
      "confidence": 0.5,
      "evidence_id": "E014",
      "locator": {
        "end_ms": 70000,
        "keyframe": "derived/video/N31_VIDEO_OPERATION_FULL/frames/frame_000014.jpg",
        "start_ms": 65000
      },
      "relevance": 0.65,
      "review_status": "UNREVIEWED",
      "source_ref": "N31_VIDEO_OPERATION_FULL",
      "source_type": "video"
    },
    {
      "claim": "CONTINUOUS_OPERATION 关键帧候选；等待授权后的视觉理解或人工确认动作、部件和设备状态。",
      "classification": "MODEL_INFERENCE",
      "confidence": 0.5,
      "evidence_id": "E018",
      "locator": {
        "end_ms": 90000,
        "keyframe": "derived/video/N31_VIDEO_OPERATION_FULL/frames/frame_000018.jpg",
        "start_ms": 85000
      },
      "relevance": 0.65,
      "review_status": "UNREVIEWED",
      "source_ref": "N31_VIDEO_OPERATION_FULL",
      "source_type": "video"
    },
    {
      "claim": "CONTINUOUS_OPERATION 关键帧候选；等待授权后的视觉理解或人工确认动作、部件和设备状态。",
      "classification": "MODEL_INFERENCE",
      "confidence": 0.5,
      "evidence_id": "E044",
      "locator": {
        "end_ms": 220000,
        "keyframe": "derived/video/N31_VIDEO_OPERATION_FULL/frames/frame_000044.jpg",
        "start_ms": 215000
      },
      "relevance": 0.65,
      "review_status": "UNREVIEWED",
      "source_ref": "N31_VIDEO_OPERATION_FULL",
      "source_type": "video"
    },
    {
      "claim": "CONTINUOUS_OPERATION 关键帧候选；等待授权后的视觉理解或人工确认动作、部件和设备状态。",
      "classification": "MODEL_INFERENCE",
      "confidence": 0.5,
      "evidence_id": "E048",
      "locator": {
        "end_ms": 240000,
        "keyframe": "derived/video/N31_VIDEO_OPERATION_FULL/frames/frame_000048.jpg",
        "start_ms": 235000
      },
      "relevance": 0.65,
      "review_status": "UNREVIEWED",
      "source_ref": "N31_VIDEO_OPERATION_FULL",
      "source_type": "video"
    },
    {
      "claim": "MEDIA_REVERSE_AND_GAP 关键帧候选；等待授权后的视觉理解或人工确认动作、部件和设备状态。",
      "classification": "MODEL_INFERENCE",
      "confidence": 0.5,
      "evidence_id": "E066",
      "locator": {
        "end_ms": 5000,
        "keyframe": "derived/video/N31_VIDEO_MEDIA_TYPE/frames/frame_000001.jpg",
        "start_ms": 0
      },
      "relevance": 0.75,
      "review_status": "UNREVIEWED",
      "source_ref": "N31_VIDEO_MEDIA_TYPE",
      "source_type": "video"
    },
    {
      "claim": "PAPER_GUIDE_ADJUSTMENT 关键帧候选；等待授权后的视觉理解或人工确认动作、部件和设备状态。",
      "classification": "MODEL_INFERENCE",
      "confidence": 0.5,
      "evidence_id": "E069",
      "locator": {
        "end_ms": 5000,
        "keyframe": "derived/video/N31_VIDEO_GUIDES/frames/frame_000001.jpg",
        "start_ms": 0
      },
      "relevance": 0.75,
      "review_status": "UNREVIEWED",
      "source_ref": "N31_VIDEO_GUIDES",
      "source_type": "video"
    },
    {
      "claim": "PAPER_GUIDE_ADJUSTMENT 关键帧候选；等待授权后的视觉理解或人工确认动作、部件和设备状态。",
      "classification": "MODEL_INFERENCE",
      "confidence": 0.5,
      "evidence_id": "E074",
      "locator": {
        "end_ms": 30000,
        "keyframe": "derived/video/N31_VIDEO_GUIDES/frames/frame_000006.jpg",
        "start_ms": 25000
      },
      "relevance": 0.75,
      "review_status": "UNREVIEWED",
      "source_ref": "N31_VIDEO_GUIDES",
      "source_type": "video"
    },
    {
      "claim": "GAP_LABEL_LEARNING 关键帧候选；等待授权后的视觉理解或人工确认动作、部件和设备状态。",
      "classification": "MODEL_INFERENCE",
      "confidence": 0.5,
      "evidence_id": "E077",
      "locator": {
        "end_ms": 5000,
        "keyframe": "derived/video/N31_VIDEO_LEARNING/frames/frame_000001.jpg",
        "start_ms": 0
      },
      "relevance": 0.7,
      "review_status": "UNREVIEWED",
      "source_ref": "N31_VIDEO_LEARNING",
      "source_type": "video"
    },
    {
      "claim": "MEDIA_FEED 关键帧候选；等待授权后的视觉理解或人工确认动作、部件和设备状态。",
      "classification": "MODEL_INFERENCE",
      "confidence": 0.5,
      "evidence_id": "E079",
      "locator": {
        "end_ms": 5000,
        "keyframe": "derived/video/N31_VIDEO_MEDIA_FEED/frames/frame_000001.jpg",
        "start_ms": 0
      },
      "relevance": 0.7,
      "review_status": "UNREVIEWED",
      "source_ref": "N31_VIDEO_MEDIA_FEED",
      "source_type": "video"
    },
    {
      "claim": "PRINT_SUCCESS_CHECK 关键帧候选；等待授权后的视觉理解或人工确认动作、部件和设备状态。",
      "classification": "MODEL_INFERENCE",
      "confidence": 0.5,
      "evidence_id": "E082",